{
  "$schema": "http://127.0.0.1:8000/schemas/suite.schema.json",
  "format": 1,
  "title": "{{name}}",
  "description": "Three sealed apps: one takes text, one analyses it in WebAssembly, one shows the result.",
  "styles": [
    "ui/theme.css",
    "ui/button.css",
    "ui/field.css",
    "ui/card.css",
    "ui/type.css",
    "ui/surface.css",
    "style.css"
  ],
  "surface": "glass",
  "apps": [
    {
      "name": "text",
      "provides": [
        "analyze"
      ],
      "caps": [
        "asset"
      ]
    },
    {
      "name": "input",
      "slot": "aside",
      "wrap": "<aside class=\"w-card w-glass panel\">",
      "emits": {
        "text:changed": {
          "retain": true
        }
      },
      "caps": [
        "storage"
      ]
    },
    {
      "name": "output",
      "slot": "main",
      "wrap": "<section class=\"w-card w-glass panel\">",
      "listens": [
        "text:changed"
      ],
      "needs": [
        "text.analyze"
      ]
    }
  ],
  "scripts": []
}
