{
  "$schema": "http://127.0.0.1:8000/schemas/suite.schema.json",
  "format": 1,
  "title": "Meeting notes",
  "description": "Paste meeting notes or a transcript and get a summary, the decisions, a checklist of action items and the open questions. Uses Claude when it is set up, and a local reader when it is not.",
  "styles": [
    "ui/theme.css",
    "ui/button.css",
    "ui/field.css",
    "ui/card.css",
    "ui/badge.css",
    "ui/type.css",
    "ui/surface.css",
    "style.css"
  ],
  "scripts": [
    "shared/text.js"
  ],
  "surface": "glass",
  "apps": [
    {
      "name": "notes",
      "slot": "aside",
      "wrap": "<aside class=\"w-card w-glass panel\">",
      "scripts": [
        "apps/notes/sample.js"
      ],
      "emits": {
        "notes:changed": {
          "retain": true
        }
      },
      "caps": [
        "storage"
      ]
    },
    {
      "name": "reader",
      "slot": "aside",
      "wrap": "<aside class=\"w-card w-glass panel\">",
      "scripts": [
        "apps/reader/local.js",
        "apps/reader/words.js"
      ],
      "listens": [
        "notes:changed"
      ],
      "emits": {
        "notes:extracted": {
          "retain": true
        }
      },
      "needs": [
        "ai.status",
        "ai.read",
        "ai.cancel"
      ],
      "caps": [
        "storage"
      ]
    },
    {
      "name": "summary",
      "slot": "main",
      "wrap": "<section class=\"w-card w-glass panel\">",
      "listens": [
        "notes:extracted"
      ]
    },
    {
      "name": "actions",
      "slot": "main",
      "wrap": "<section class=\"w-card w-glass panel\">",
      "listens": [
        "notes:extracted"
      ],
      "emits": {
        "actions:changed": {
          "retain": true
        }
      },
      "caps": [
        "storage"
      ]
    },
    {
      "name": "export",
      "slot": "main",
      "wrap": "<section class=\"w-card w-glass panel\">",
      "listens": [
        "notes:extracted",
        "actions:changed"
      ],
      "caps": [
        "claude:downloads"
      ]
    },
    {
      "name": "ai",
      "scripts": [
        "ui/agent.js"
      ],
      "listens": [
        "notes:changed",
        "notes:extracted",
        "actions:changed"
      ],
      "provides": [
        "status",
        "read",
        "cancel",
        "chat"
      ],
      "caps": [
        "claude:sample",
        "asset"
      ]
    }
  ]
}
